created_at,favorite_count,id,id_str,in_reply_to_user_id_str,quote_count,reply_count,retweet_count,text,withheld_in_countries,name,location,UID
2019-07-02 15:28,0,1.14608E+18,1.14608E+18,,0,0,0,Have these scientists never watched Planet of the Apes,,Ian Molnar,St Thomas Ontario,19577524
2019-07-02 15:28,0,1.14608E+18,1.14608E+18,,0,0,0,Happy belated Canada day ,,A Canadian Beaver,Ontario Canada,1.06751E+18
2019-07-02 15:28,0,1.14608E+18,1.14608E+18,,0,0,0,RT NatStClair A young Arctic fox has walked across the ice from Norways Svalbard islands to northern Canada in an epic journey covering,,Frist prepares for TrotCon ,Downey CA,264981164
2019-07-02 15:28,0,1.14608E+18,1.14608E+18,,0,0,0,RT GuardOfForever cathmckennaRalphGoodaleJustinTrudeauWould this qualify as some sort of emergencyRCMP task force finds,,Elliott,,39115098
2019-07-02 15:28,0,1.14608E+18,1.14608E+18,,0,0,0,RT DeanWinnipeg There is at least prima facie evidence that Canada Proud is directly feeding Russian troll farms with antiTrudeau propa,,facts matter,Canada,7.53797E+17
2019-07-02 15:28,0,1.14608E+18,1.14608E+18,,0,0,0,RT nobyrnelaw As a law professor I have done dozens of interviews with Brunswick News reporters over the past  years I will no longer,,Adam Jones,Ottawa Ontario,9.36075E+17
2019-07-02 15:28,0,1.14608E+18,1.14608E+18,,0,0,0,RT kinsellawarren This is actually a major story Will be interesting to see where it goes Dominic LeBlancs family friends neighbour,,John Dowe,,3069762388
2019-07-02 15:28,0,1.14608E+18,1.14608E+18,,0,0,0,RT yvonnetn Quote by De Adder The Irvings dont want Justin Trudeau reelected and they will not print a cartoo,,Jamie MacDonald,,300565494
2019-07-02 15:28,0,1.14608E+18,1.14608E+18,,0,0,0,RT NatStClair A young Arctic fox has walked across the ice from Norways Svalbard islands to northern Canada in an epic journey covering,, ,,954227412
2019-07-02 15:28,0,1.14608E+18,1.14608E+18,,0,0,0,RT r bobsacard dbongino Yeah CapperDick should go to Canada  and play sports there No Patriot should buy another Nike Product,,John Larson,,8.22508E+17
2019-07-02 15:28,0,1.14608E+18,1.14608E+18,,0,0,0,RT spectatorindex G countries by GDP growth India China Indonesia S Korea US Brazil Austral,,Kamlesh D Tailor,Navsari India,9.99626E+17
2019-07-02 15:28,0,1.14608E+18,1.14608E+18,,0,0,0,RT ShawnMendes Happy Canada day I love Canada   ,,HeavynLeigh,,1.0015E+18
2019-07-02 15:28,0,1.14608E+18,1.14608E+18,,0,0,0,Marnie McBean prte  mener quipe Canada  Tokyo  ,,Ferreira Da Costa Kvin,Paris France,1.05329E+18
2019-07-02 15:28,0,1.14608E+18,1.14608E+18,,0,0,0,RT Vikkstar Happy Canada Day   LachlanYT ,,Phoenix Wolf,San Antonio TX,7.64246E+17
2019-07-02 15:28,0,1.14608E+18,1.14608E+18,,0,0,0,RT deAdder Cartoonists in the US are painted as being from the left or the right Some even as Democrat or Republican Cartoonists are,,msmith,,3043639066
2019-07-02 15:28,0,1.14608E+18,1.14608E+18,,0,0,0,RT RunADZ  ,,Trollden State,,8.76645E+17
2019-07-02 15:28,0,1.14608E+18,1.14608E+18,,0,0,0,RT AuchTwo Wow  imagine dying because you had to ration your insulin due to its cost  Thats the reality in the US  Thank goodness for,,Kate,Scotland,875231172
2019-07-02 15:28,0,1.14608E+18,1.14608E+18,,0,0,0,RT LePeupleQC CANADA  TERRE DACCUEIL OU BUFFET  VOLONT MIGRATOIRE   Daprs le gouvernement fdral moins de  migrants illgau,,Francine Parent,Qubec,792139214
2019-07-02 15:28,0,1.14608E+18,1.14608E+18,116502194,0,0,0,globalnews Yeah our  of global emissions are to blame As south park would say blame Canada,,todgoodweather ,,1625981479
2019-07-02 15:28,0,1.14608E+18,1.14608E+18,,0,0,0,Max just got dropped off to Shred the Gnar   Whistler Canada ,,Shred the Gnar,,1.12911E+18
2019-07-02 15:28,0,1.14608E+18,1.14608E+18,,0,0,0,RT tales Politicians who want to bandefund abortion are lazy If they really wanted to decrease abortion they would create better sex,,Lets Play TRUTH,Still Above Ground,41706757
2019-07-02 15:28,0,1.14608E+18,1.14608E+18,,0,0,0,RT smellher Its still Canada Day somewhere right ,,Chris Hinkle,Arkansas,1114955412
2019-07-02 15:28,0,1.14608E+18,1.14608E+18,,0,0,0,RT CAFinUS As we celebrate CanadaDay were thankful for our hosts They are our partners in defending North America They are our allie,,CHOCO,Tokyo  JAPAN,116617985
2019-07-02 15:28,0,1.14608E+18,1.14608E+18,,0,0,0,free sex local postage to canada advanced systemcare test free hookup pages ,,Kaloshina Vita,,1.14442E+18
2019-07-02 15:28,0,1.14608E+18,1.14608E+18,,0,0,0,RT idkliliane LET HIM HIKE ,, ,Destiny Islands,329396726
2019-07-02 15:28,0,1.14608E+18,1.14608E+18,,0,0,0,RT nywolforg WOW A young Arctic fox has walked across the ice from Norways Svalbard islands to northern Canada in an epic journey cov,,Patrick Chaaya,Beirut Lebanon,916407937
2019-07-02 15:28,0,1.14608E+18,1.14608E+18,,0,0,0,RT nickjcss apparently its canada day and yall know what that means ,,Carol,Portugal,1.00008E+18
2019-07-02 15:28,0,1.14608E+18,1.14608E+18,,0,0,0,One of the best days of my entire life Notes from a cross Canada vehicle relocation road trip ,,HitTheRoadca,Canada,22709020
2019-07-02 15:28,0,1.14608E+18,1.14608E+18,,0,0,0,USA will play the last place team from Group Bwill be one of Canada Australia and Latvia Latvia is currently t ,,Matt Shoultz,Ames Iowa,108966067
2019-07-02 15:28,0,1.14608E+18,1.14608E+18,,0,0,0,Jusquau boutje supporterai mon quipeJe lai fait la dernire foisjai t lconfiante mme lorsque le score ,,Joseph Lindsey,,1.13778E+18
2019-07-02 15:28,0,1.14608E+18,1.14608E+18,,0,0,0,RT Ningnin Bye bye toronto got World tour in toronto canada markbam MarkTuan bambam BamBamA Jacksonwang Jinyoung,,leah loves GOT,jwbbkjmkjdkjizyx,1.13283E+18
2019-07-02 15:28,0,1.14608E+18,1.14608E+18,,0,0,0,RT mannyottawa Dont forget this the same Cabinet Minister found GUILTY under Federal Ethics Law for giving family member M contract,,RenierArtens BLeafBernierNationPPC,Ontario Canada,1283853732
2019-07-02 15:28,0,1.14608E+18,1.14608E+18,,0,0,0,In just  minutes you can learn how to process JSON files using the command line on Graham and other Compute Canad ,,SHARCNET,Canada,90005078
2019-07-02 15:28,0,1.14608E+18,1.14608E+18,,0,0,0,Will be the end for sure of the GVT Go ahead JT make Canada Free again,,Gail St Louis,,1.04503E+18
2019-07-02 15:28,0,1.14608E+18,1.14608E+18,,0,0,0,RT boehmerB My mayor Nenshi is pretty bad but he would never trivialize the kidnapping of two Canadian citizens as challenges Helps,,JForest,,3150800516
2019-07-02 15:28,0,1.14608E+18,1.14608E+18,,0,0,0,RT umusic HappyCanadaDay Stream your faves like Justin Bieber The Weeknd and more for the chance to WIN a bluetooth speaker a coo,,Hexis Kaneki,,7.94475E+17
2019-07-02 15:28,0,1.14608E+18,1.14608E+18,,0,0,0,RT Firstscreamto Ive just been made aware that its Canada day and I LOVE Canada ,,Chris ,Philadelphia PA,2861734173
2019-07-02 15:28,0,1.14608E+18,1.14608E+18,,0,0,0,Bird feeding chick cigarette end captured in picture ,,Janice Dash,iPhone ,50791051
2019-07-02 15:28,0,1.14608E+18,1.14608E+18,,0,0,0,RT cultofdusty Never thought I would say this but fuck off Canada ,,SOYtherion Steve,,795067362
2019-07-02 15:28,0,1.14608E+18,1.14608E+18,,0,0,0,RT EdtheSock I was at MitzieHunters CanadaDay event It was nonpartisan nonpolitical There were NO speeches mentioning the Liberal,,Port Credit ,,404085374
2019-07-02 15:28,0,1.14608E+18,1.14608E+18,,0,0,0,RT philosophrob Canada Singlepayer healthcare Legal cannabis for adult use  weeks of paid parental leave  days of paid vacat,,I shouldnt have said tapes,,104830883
2019-07-02 15:28,0,1.14608E+18,1.14608E+18,,0,0,0,RT RussDiabo King of the mountain For  years a Lilwat chief keeps a lonely vigil in the BC woods via globeandmail ,,Gerome G,Coldwater  British Columbia,950990450
2019-07-02 15:28,0,1.14608E+18,1.14608E+18,,0,0,0,RT ShawnMendes Happy Canada day I love Canada   ,,Roxana Castillo,,1.0969E+18
2019-07-02 15:28,0,1.14608E+18,1.14608E+18,,0,0,0,RT officialACE              ACE CHOICETOUR CANADA ,,mrbass,,1.11788E+18
2019-07-02 15:28,0,1.14608E+18,1.14608E+18,,0,0,0,RT paulisci Happy Canada Day ,,The GORDgoyle King,,2479367584
2019-07-02 15:28,0,1.14608E+18,1.14608E+18,,0,0,0,RT NatStClair A young Arctic fox has walked across the ice from Norways Svalbard islands to northern Canada in an epic journey covering,,Kathleen BoycottNRA,Chicago IL,8.31572E+17
2019-07-02 15:28,0,1.14608E+18,1.14608E+18,,0,0,0,RT jandles So many idiots with this takeKD KD had a  lead to GSW KD and co blew said  lead KD went and joined said team,,Tucc,,1180510916
2019-07-02 15:28,0,1.14608E+18,1.14608E+18,,0,0,0,RT nywolforg WOW A young Arctic fox has walked across the ice from Norways Svalbard islands to northern Canada in an epic journey cov,,Axdyn,CA,752776542
2019-07-02 15:28,0,1.14608E+18,1.14608E+18,,0,0,0,RT RikerLynch Happy Canada Day to all the awesome people up north You guys invented hockey and I am forever grateful ,,Paige Abbott,BristolEngland ,9.28665E+17
2019-07-02 15:28,0,1.14608E+18,1.14608E+18,,0,0,0,RT MarjanFa Dear Canada we are waiting for your response to IranianRefugeesInTurkey whoescaped persecution and other humanrights vi,,Kunta,InFutureDublin City Ireland,8.07668E+17
2019-07-02 15:28,0,1.14608E+18,1.14608E+18,,0,0,0,Tickets booked to see MurderSmall in Cleveland Coming from Canada for the second time You guys need to do a show here soon,,Jaimie Marshall,Whitby Ontario,48563702
2019-07-02 15:28,0,1.14608E+18,1.14608E+18,1.07E+18,0,0,0,kilojamin Heres some Canada day pics from across Canada and totally random at that pulled from the internet this ,,ZROFX,Canada,35285058
2019-07-02 15:28,0,1.14608E+18,1.14608E+18,,0,0,0,RT NatStClair A young Arctic fox has walked across the ice from Norways Svalbard islands to northern Canada in an epic journey covering,,Bishal Paul,Kolkata India,1.13111E+18
2019-07-02 15:28,0,1.14608E+18,1.14608E+18,,0,0,0,Dclaration de lhonorableAhmedHussen loccasiondelafteduCanada   ,,CAPICACCPI,Canada,156010522
2019-07-02 15:28,0,1.14608E+18,1.14608E+18,,0,0,0,RT CCPABC Instead of indulging in dangerous wishful thinking that LNG is a solution to climate change Canada should instead start livin,,Trevor Wiens,Calgary Alberta,292728050
2019-07-02 15:28,0,1.14608E+18,1.14608E+18,,0,0,0,RT AutoNewsCanada The Dilawri Group of Companies Canadas largest dealership group is changing its digital presence with a major relaun,, Agency,Montral Qubec,8.29E+17
2019-07-02 15:28,0,1.14608E+18,1.14608E+18,,0,0,0,RT GiovanniAgost LItalia  uno dei paesi che ha avuto una cospicua emigrazione nellultimo secolo circa  milioni di persone sparse,,Antongiulio Tempesta,Sardegna,496043380
2019-07-02 15:28,0,1.14608E+18,1.14608E+18,,0,0,0,RT theresemacdona I just love our Prime Minister Hes so natural and sincere with an energy Canada needs Im just plain proud of him,,Nickie ,BuckABeerBuffoon Province,378298356
2019-07-02 15:28,0,1.14608E+18,1.14608E+18,,0,0,0,RT guardian Fantastic arctic fox animal walks km from Norway to Canada ,,Bishal Paul,Kolkata India,1.13111E+18
2019-07-02 15:28,0,1.14608E+18,1.14608E+18,,0,0,0,Oh uhhh happy birthday Canada I guess,,Gay Queer Trans Hank Hill,Does not represent anyone,7.71196E+17
2019-07-02 15:28,0,1.14608E+18,1.14608E+18,,0,0,0,RT kamalhothi A young Arctic fox has walked across the ice from Norways Svalbard islands to northern Canada in an epic journey coveri,,John Obbo,,24348660
2019-07-02 15:28,0,1.14608E+18,1.14608E+18,,0,0,0,RT jandles So many idiots with this takeKD KD had a  lead to GSW KD and co blew said  lead KD went and joined said team,,,Baton Rouge LA,1942326949
2019-07-02 15:28,0,1.14608E+18,1.14608E+18,,0,0,0,RT westernkia Happy Canada Day  HappyCanadaDay KiaCanada newfoundland cornerbrook ,,Kia Canada,Canada,144316908
2019-07-02 15:28,0,1.14608E+18,1.14608E+18,,0,0,0,RT HistoricaCanada After the historic championship win Canada is loving the Raptors but lets send some love to other Canadian dinosau,,Warrior Flower Princess,Planet Earth,1.02007E+18
2019-07-02 15:28,0,1.14608E+18,1.14608E+18,,0,0,0,RT ASLuhn Arctic fox ran with tracking collar ran  miles across the ice from Norway Svalbard to Canada in only  months Arctic,,dreamsoffire,Chicago IL,395401199
2019-07-02 15:28,0,1.14608E+18,1.14608E+18,,0,0,0,Around Canada Day its important to share the national perspective of PSPCs Workplace Renewal Initiative ,,WRI  IRMT,,9.43855E+17
2019-07-02 15:28,0,1.14608E+18,1.14608E+18,,0,0,0,RT JustinTrudeau Proud to be Canadian today and every day Happy Canada Day  ,,Heather Nelson,London Ontario ,593172624
2019-07-02 15:28,0,1.14608E+18,1.14608E+18,1.11E+18,0,0,0,Hinekure CANADA,,,,1.09169E+18
2019-07-02 15:28,0,1.14608E+18,1.14608E+18,379408088,0,0,0,ShawnMendes idols Thanks babe Happy Canada Day  i miss my big family over there,,Mar ,Roma Lazio,606464319
2019-07-02 15:28,0,1.14608E+18,1.14608E+18,,0,0,0,RT HouleJonathan  se souvenir quand ric Duhaime JeanFranois Fillion Jromes Landry et les autres populistes nous vantent le prix de,,Michelle,,599520401
2019-07-02 15:28,0,1.14608E+18,1.14608E+18,,0,0,0,vs faisiez quoi en gographie man ,,Raspberry,Montreal Canada,1.00713E+18
2019-07-02 15:28,0,1.14608E+18,1.14608E+18,,0,0,0,RT apihtawikosisan Every year Indigenous ppl are told its mighty rude to protest and disrupt Canada Day celebrations Lol Ruder that ,,Lauren Petersen,Victoria British Columbia,65833585
2019-07-02 15:28,0,1.14608E+18,1.14608E+18,,0,0,0,RT kinsellawarren This is actually a major story Will be interesting to see where it goes Dominic LeBlancs family friends neighbour,,Dylan gabaiOrion BernierNation,Gasp QC Canada,1120000410
2019-07-02 15:28,0,1.14608E+18,1.14608E+18,5768872,0,0,0,garyvee In Canada ,,Dr Erin Schryer,Saint John NB,24939699
2019-07-02 15:28,0,1.14608E+18,1.14608E+18,,0,0,0,RT YyzkevinBull Inspiring to hear JustinTrudeau credit achievements to those who have contributed what has been achieved ie not himse,,GL,Riverview NB,215328456
2019-07-02 15:28,0,1.14608E+18,1.14608E+18,,0,0,0,RT mobilegrowthMGS Join us for MobileGrowth Summit on August  in the SimpsonTower Toronto  where lejeunesimon will talk about Th,,Hopper,Boston  Montreal,27472675
2019-07-02 15:28,0,1.14608E+18,1.14608E+18,,0,0,0,,,e,,507271259
2019-07-02 15:28,0,1.14608E+18,1.14608E+18,,0,0,0,Ive received some really great feedback from customers who returned from Canada recently  It always makes my day ,,Emma Savage,,138361192
2019-07-02 15:28,0,1.14608E+18,1.14608E+18,,0,0,0,RT NothingCanada In honour of CanadaDay amp our shows st birthday coming soon weve started a brand new adventure for you all to join,,Verity Clayton,,1.08788E+18
2019-07-02 15:28,0,1.14608E+18,1.14608E+18,,0,0,0,Love to hear these stories,,Ellen,Ontario Canada,257244279
2019-07-02 15:28,0,1.14608E+18,1.14608E+18,,0,0,0,RT GailZwicker Congratulations AlexNewhook and family NHLdraft Newhook trending in Canada shawnnewhook PaulaNewhook abbynewhoo,,Cherry Brook,,1.13906E+18
2019-07-02 15:28,0,1.14608E+18,1.14608E+18,,0,0,0,RT ShawnMendes Happy Canada day I love Canada   ,, ,Ottawa Ontario,3198362767
2019-07-02 15:28,0,1.14608E+18,1.14608E+18,,0,0,0,RT sunshinejvo happy canada day johnnyorlando TheJohnnyHQ ,, ,Thailand,9.69571E+17
2019-07-02 15:28,0,1.14608E+18,1.14608E+18,,0,0,0,Help us reach   Petition to stop CBC Horoscopes Lets end publiclyfunded horoscopessuperstition ,,Oscar Starschild,U of T Ontario   Island,1.08917E+18
2019-07-02 15:28,0,1.14608E+18,1.14608E+18,,0,0,0,Amen,,Church Plant Stittsville,,1.14173E+18
2019-07-02 15:28,0,1.14608E+18,1.14608E+18,,0,0,0,RT WeAreCanProud Doug Ford fired his chief of staff for sleazy patronageWill any Liberal lose their job for this gross political corru,,JForest,,3150800516
2019-07-02 15:28,0,1.14608E+18,1.14608E+18,,0,0,0,RT cosminDZS Now that everybodys attention is on Antifa because of the vicious attack on MrAndyNgo in Portland I thought Id do a roun,,Lorne Clinton,Red Deer Alberta Canada,1581128899
2019-07-02 15:28,0,1.14608E+18,1.14608E+18,,0,0,0,RT ABWarRoom FOR IMMEDIATE RELEASETodays weather event in Albertas Capital on Canada Day is an act of War by Mother Nature against t,,emgfind,Alberta Canada,2925571294
2019-07-02 15:28,0,1.14608E+18,1.14608E+18,,0,0,0,RT llewellynjobs Canada DayYou took my Mom at  years old  Put her and her siblings in residential school You took me away at birt,,jess ,buckys arms,2795111700
2019-07-02 15:28,0,1.14608E+18,1.14608E+18,,0,0,0,RT Guly Im a survivor of July th Urumqi Massacre in  I witnessed Chinese cruelty And now witnessing worlds cruelty on Uyghur,,Victory ,,8.56714E+17
2019-07-02 15:28,0,1.14608E+18,1.14608E+18,,0,0,0,RT yvonnetn Quote by De Adder The Irvings dont want Justin Trudeau reelected and they will not print a cartoo,,Lorie,Ontario Canada,8.31996E+17
2019-07-02 15:28,0,1.14608E+18,1.14608E+18,,0,0,0,RT SoulCharmer Was a Beyond Gorgeous day today as the sun just warmed your Smile to the coreWas a very beautiful Canada Day  http,,Forced  Happenstance,ABOVE the STRATOSPHERE,9.77431E+17
2019-07-02 15:28,0,1.14608E+18,1.14608E+18,,0,0,0,RT NatStClair A young Arctic fox has walked across the ice from Norways Svalbard islands to northern Canada in an epic journey covering,,K,,384863300
2019-07-02 15:28,0,1.14608E+18,1.14608E+18,,0,0,0,RT velasquezluis edumartinezd GTAveledo JulioBorges Orlando Viera Blanco es abogado en ejercicio en Canada posee una firma No es f,,eustacioesaa,,1.07192E+18
2019-07-02 15:28,0,1.14608E+18,1.14608E+18,,0,0,0,RT Dimcl See this USA  This is how a leader celebrates our day in Canada No tanks no jets no marching soldiers no elite special,,Hafeez Noorani ,North Vancouver,149251049
2019-07-02 15:28,0,1.14608E+18,1.14608E+18,,0,0,0,RT NatStClair A young Arctic fox has walked across the ice from Norways Svalbard islands to northern Canada in an epic journey covering,,Katie Kennedy,,9.25899E+17
2019-07-02 15:28,0,1.14608E+18,1.14608E+18,179569408,0,0,0,DublinAirport AirCanada such a great prize valeriemitch mitcheileen,,N Mhistal Audrey,,368527800
2019-07-02 15:28,0,1.14608E+18,1.14608E+18,9.45E+17,0,0,0,avesbergy Are you interested in seeking sugardaddy Im gonna be giving you  weekly USA amp Canada only Message me  ,,charlies,,1.14379E+18
2019-07-02 15:28,0,1.14608E+18,1.14608E+18,,0,0,0,RT LeeGoldbergABC The EmpireStateBldg lit red and white honoring the Consulate General Of Canada In New York and Canada Day abcny ht,,Rafael Pena ,Boston MA,9.02686E+17
2019-07-02 15:28,0,1.14608E+18,1.14608E+18,58007320,0,0,0,RodStryker POTUS They are bad in Canada in well They having all kinds of issues with this group of terrorists,,Texas Patriot Girl MAGA ,Texas,2382886129
2019-07-02 15:28,0,1.14608E+18,1.14608E+18,,0,0,0,RT jandles So many idiots with this takeKD KD had a  lead to GSW KD and co blew said  lead KD went and joined said team,,Ty Dolla ,,347611299
2019-07-02 15:28,0,1.14608E+18,1.14608E+18,,0,0,0,RT HoCStaffer Anyone know a good realtor in Moncton I am looking for a house in Dominic LeBlancs neighbourhood ,,Carolyn,,1.13905E+18
2019-07-02 15:29,0,1.14608E+18,1.14608E+18,,0,0,0,Latvia U vs Canada U Basketball HD Highlights  Jul  World Championship U ,,manoj,,1.10498E+18
2019-07-02 15:29,0,1.14608E+18,1.14608E+18,,0,0,0,If we dont decide to change this country its simply not going to happen Geoffrey Canada asca ASCAtweets ,,Whitney Triplett,San Diego CA,735381602
2019-07-02 15:29,0,1.14608E+18,1.14608E+18,,0,0,0,RT Jazzigator  lt Cool Channelsgt playing Smooth Contemporary Rare amp Vintage Jazz plus Celebrity Interviews To,,Jazzigator,New England United States,226636852
2019-07-02 15:29,0,1.14608E+18,1.14608E+18,,0,0,0,RT guardian Fantastic arctic fox animal walks km from Norway to Canada ,,Webb Art,Sunnyvale CA,1.02622E+18
2019-07-02 15:29,0,1.14608E+18,1.14608E+18,,0,0,0,RT JocAPhotography I hadnt been able to find the Sandhill Crane family with the adopted Canada Goose for several days  I believe they w,,Ky,,1147713493
2019-07-02 15:29,0,1.14608E+18,1.14608E+18,,0,0,0,RT guardian Fantastic arctic fox animal walks km from Norway to Canada ,,zcarr ,,8.36719E+17
2019-07-02 15:29,0,1.14608E+18,1.14608E+18,,0,0,0,RT RussDiabo King of the mountain For  years a Lilwat chief keeps a lonely vigil in the BC woods via globeandmail ,,Dawn Sparks,,1.1012E+18
2019-07-02 15:29,0,1.14608E+18,1.14608E+18,,0,0,0,RT NatStClair A young Arctic fox has walked across the ice from Norways Svalbard islands to northern Canada in an epic journey covering,,humgry tiger,,7.6309E+17
2019-07-02 15:29,0,1.14608E+18,1.14608E+18,,0,0,0,US Border Patrol investigate disturbing secret Facebook group ,,Rainbow Coder,Seattle US,38293838
2019-07-02 15:29,0,1.14608E+18,1.14608E+18,,0,0,0,RT radnature Joffre Lakes Trail Canada  ,,Riley,,555516584
2019-07-02 15:29,0,1.14608E+18,1.14608E+18,,0,0,0,RT VancouverSun An Arctic fox walked from Norway to Canada in just  days Thats  km three countries and two continents ,,Theresa CarleSanders,,399699041
2019-07-02 15:29,0,1.14608E+18,1.14608E+18,,0,0,0,Canadas Conservatives are adopting a disinformation strategy straight from Trumps playbook  via djclimenhaga ,,rabbleca,T ,14181214
2019-07-02 15:29,0,1.14608E+18,1.14608E+18,9.67E+17,0,0,0,rebhenderson IvankaTrump StateIVLP Thank you for responding ding to further my accurate assessment of Canucks ,,Sweet Southern Girl,The Deep South,635735256
2019-07-02 15:29,0,1.14608E+18,1.14608E+18,,0,0,0,RT FightOwensFight Every single week I hear the same thing no matter where I am in the worldGo back to CanadaMy answer is the s,,DrPure,Doha Qatar,8.57283E+17
2019-07-02 15:29,0,1.14608E+18,1.14608E+18,,0,0,0,RT ShawnMendes Happy Canada day I love Canada   ,,Rafael Pena ,Boston MA,9.02686E+17
2019-07-02 15:29,0,1.14608E+18,1.14608E+18,,0,0,0,RT TheNeuroMNI Congratulations to Hanna Pappius whose groundbreaking work in the field of neuroscience has been recognized with appoin,,Dr Nadia Chaudhri,Canada,1.07956E+18
2019-07-02 15:29,0,1.14608E+18,1.14608E+18,,0,0,0,RT ETurkistan                     ,,Andro alhag,,1.08699E+18
2019-07-02 15:29,0,1.14608E+18,1.14608E+18,,0,0,0,RT ASLuhn Arctic fox ran with tracking collar ran  miles across the ice from Norway Svalbard to Canada in only  months Arctic,,hipmum,BC Canada,146616748
2019-07-02 15:29,0,1.14608E+18,1.14608E+18,,0,0,0,RT mjt whiteblue The Uighur people will be free soon   Lets hit the streets peacefully protest and Lets fight together,,Namtulla,Oslo Norway,1.0798E+18
2019-07-02 15:29,0,1.14608E+18,1.14608E+18,,0,0,0,RT jandles So many idiots with this takeKD KD had a  lead to GSW KD and co blew said  lead KD went and joined said team,,Akin Lekan,Charlotte NC ADOS,417560239
2019-07-02 15:29,0,1.14608E+18,1.14608E+18,,0,0,0,RT AerZerRik THE HARVEST REMASTEREDNumbers Drawn Time to BakeHad fun doing this one need to do more Pinkamena tbh Also Hap,,GalaxyInk,,1.13455E+18
2019-07-02 15:29,0,1.14608E+18,1.14608E+18,,0,0,0,RT WalderSports But Canada loves its hockey Sure but  ,,Jay,,198177863
2019-07-02 15:29,0,1.14608E+18,1.14608E+18,,0,0,0,Happy Canada Day pnpcanada ,,akram israr,torontoontario  canada,2819496752
2019-07-02 15:29,0,1.14608E+18,1.14608E+18,,0,0,0,Kudos and a belated Happy Canada Day to you,,Expertscape DailyExperts,Baltimore MD  The Medical City,1.09218E+18
2019-07-02 15:29,0,1.14608E+18,1.14608E+18,,0,0,0,RT Terrilltf Please retweet Kaepernick ,,Gerome G,Coldwater  British Columbia,950990450
2019-07-02 15:29,0,1.14608E+18,1.14608E+18,,0,0,0,p  M to M  Northern Ontario Canada    p  ry We expect a M to M earthquake in Northern ,,Earthquake Prediction Project,,8.00812E+17
2019-07-02 15:29,0,1.14608E+18,1.14608E+18,,0,0,0,Un orgullo ver como se materializa el potencial de nuestra ingeniera en todo el mundo,,Andrs Lorenzo,Madrid Comunidad de Madrid,3184782281
2019-07-02 15:29,0,1.14608E+18,1.14608E+18,,0,0,0,Maybe you didnt get the memo Im actually obliged to spit on you if youre wearing Canada goose,,binary hating bat,put your pronouns in your bio,9.49759E+17
2019-07-02 15:29,0,1.14608E+18,1.14608E+18,,0,0,0,RT sumostevenson Currently a tournament is taking place in the US featuring NZ England Canada France and the US Its called the Super,,CHINO,Nairobi Kenya,9.6475E+17
2019-07-02 15:29,0,1.14608E+18,1.14608E+18,,0,0,0,RT blogTO Happy nd Canada  Toronto CanadaDay ,,Rafael Pena ,Boston MA,9.02686E+17
2019-07-02 15:29,0,1.14608E+18,1.14608E+18,,0,0,0,RT ClodyaTim Le cofondateur de Wikipdia appelle  une grve des rseaux sociaux pendant  heures pour dnoncer la mainmise des grandes,,Frdric DAstous,Montrgie Qc,467709390
2019-07-02 15:29,0,1.14608E+18,1.14608E+18,2908017153,0,0,0,USMCLiberal Good thing no one cares what the hell you think  Move to Canada or Iran,,JayDJetMAGA,Queens NY,221614751
2019-07-02 15:29,0,1.14608E+18,1.14608E+18,,0,0,0,RT ShawnMendes Happy Canada day I love Canada   ,,Boyan Shi,,7.28187E+17
2019-07-02 15:29,0,1.14608E+18,1.14608E+18,,0,0,0,I wonder how strong you would think the relationship is if you were one of the hostages facing the death penalty,,John Bad ,,7.71831E+17
2019-07-02 15:29,0,1.14608E+18,1.14608E+18,,0,0,0,RT chiefladybird I originally made this for Canada  but Im just going to repost it every year because we resist every fucking day,,idt,Bitchita Falls Tx,1868846125
2019-07-02 15:29,0,1.14608E+18,1.14608E+18,,0,0,0,Important Grifter grifting  The G with daddy,,Pamela Kivett,Indianapolis IN,284048978
2019-07-02 15:29,0,1.14608E+18,1.14608E+18,,0,0,0,RT davelackie In honour of Canada Day were giving away DSquareds Wood pour Femme fragrance  a fresh woodyfloral for her with notes,,Manni,UK ,1120260800
2019-07-02 15:29,0,1.14608E+18,1.14608E+18,,0,0,0,RT BCWineTrends  new BCwine releases to try on CanadaDay StudioWine blackmarketwine SperlingVyds winemakerscut Happy Canada Day,,Winemakers CUT ,Oliver British Columbia,9.26103E+17
