created_at,favorite_count,id,id_str,in_reply_to_user_id_str,quote_count,reply_count,retweet_count,text,withheld_in_countries,name,location,UID
2019-07-02 15:24,0,1.14608E+18,1.14608E+18,,0,0,0,RT MichelleRempel I wonder if there were all made after Puglaas was conveniently and unceremoniously shunted out of the way ,,Cave Man,BC,381136617
2019-07-02 15:24,0,1.14608E+18,1.14608E+18,,0,0,0,,,Dennis,Toronto,363353325
2019-07-02 15:24,0,1.14608E+18,1.14608E+18,,0,0,0,Geoffrey Canada says kids and especially poor kids havent been on the radar here in all the political debates late ,,Meredith AndersonPhD,Washington DC,3333661967
2019-07-02 15:24,0,1.14608E+18,1.14608E+18,,0,0,0,RT NatStClair A young Arctic fox has walked across the ice from Norways Svalbard islands to northern Canada in an epic journey covering,,Belinda,Washington DC,2358457956
2019-07-02 15:24,0,1.14608E+18,1.14608E+18,,0,0,0,Answer to How does China expect to pressure Canada to defy the USs requests to extradite Huaweis CFO and to ban H ,,Ozgur Zeren,,3004210019
2019-07-02 15:24,0,1.14608E+18,1.14608E+18,,0,0,0,RT Staffieri Cut federal tax to  on income between  and  and  tax rate on income above  family earning ,,Bret  PPC,Saint John New Brunswick,363710590
2019-07-02 15:24,0,1.14608E+18,1.14608E+18,,0,0,0,RT NatStClair A young Arctic fox has walked across the ice from Norways Svalbard islands to northern Canada in an epic journey covering,,Chip Fox ,Colorado USA,168717945
2019-07-02 15:24,0,1.14608E+18,1.14608E+18,,0,0,0,Surprise from the animalkingdom as a Arcticfox walks from Norway to Canada in  days,,prabir ghose,nashik india,29414355
2019-07-02 15:24,0,1.14608E+18,1.14608E+18,,0,0,0,RT philosophrob Canada Singlepayer healthcare Legal cannabis for adult use  weeks of paid parental leave  days of paid vacat,,R Marshall Smith,Toronto Canada,1281660648
2019-07-02 15:24,0,1.14608E+18,1.14608E+18,,0,0,0,RT klcoop Spent my morning looking into this crazy story first uncovered by AlexSamuelsx in TexasTurns out the same man had also p,,Cynthia Hennig,,91390903
2019-07-02 15:24,0,1.14608E+18,1.14608E+18,,0,0,0,RT DallasHunt Name a settler colonial nationstate that brutalizes Indigenous communities ,,not your anything,hk,6.94997E+17
2019-07-02 15:24,0,1.14608E+18,1.14608E+18,,0,0,0,RT JuananAmoros Estudios bidireccionales sobre IPV Violencia en pareja ntima ,,Alienada ,Alicante Espaa,2320555264
2019-07-02 15:24,0,1.14608E+18,1.14608E+18,61263431,0,0,0,cindymccain officialmutombo CDCgov Meanwhile the Vaccine Mafia is coming to a state or province near you Her ,,John Hansen,,1177549584
2019-07-02 15:24,0,1.14608E+18,1.14608E+18,,0,0,0,RT SJPeace I was driving back from Canada to Michigan after visiting family My car was running out of gas so stop at a gas station As,,thatotheregg,Texas USA,2614129380
2019-07-02 15:24,0,1.14608E+18,1.14608E+18,,0,0,0,RT milliondollrfam If my friends here can do anything please share this If you know people or are from Winnipeg My brother is missin,,MrsRobertWeedman,Nashville TN,124280166
2019-07-02 15:24,0,1.14608E+18,1.14608E+18,,0,0,0,RT TWRPband  HAPPY CANADA DAY  ,,The Church of the LatterStage Capitalism,Chicago IL,35628610
2019-07-02 15:24,0,1.14608E+18,1.14608E+18,,0,0,0,RT AmandaDivinee Available all week  for Outcall Ottawa Outaouais    bigboobs cc porn porno  ottawa canada vip e,,Fan Of Fake Boobs,Nantes France,8.11959E+17
2019-07-02 15:24,0,1.14608E+18,1.14608E+18,,0,0,0,RT EdtheSock I was at MitzieHunters CanadaDay event It was nonpartisan nonpolitical There were NO speeches mentioning the Liberal,,Carl Gohl,WinnipegManitoba,141416435
2019-07-02 15:24,0,1.14608E+18,1.14608E+18,,0,0,0,RT EdtheSock I was at MitzieHunters CanadaDay event It was nonpartisan nonpolitical There were NO speeches mentioning the Liberal,,Univrsle,Toronto,18191382
2019-07-02 15:24,0,1.14608E+18,1.14608E+18,,0,0,0,RT nywolforg WOW A young Arctic fox has walked across the ice from Norways Svalbard islands to northern Canada in an epic journey cov,,kfwwkfww,,1.00411E+18
2019-07-02 15:24,0,1.14608E+18,1.14608E+18,9.70E+17,0,0,0,They are poems of growth and change about mental health and coming out the other side of bad timesHere are the ,,Becka is particpating in CampNaNoWriMo,Birmingham England,9.70107E+17
2019-07-02 15:24,0,1.14608E+18,1.14608E+18,,0,0,0,RT NatStClair A young Arctic fox has walked across the ice from Norways Svalbard islands to northern Canada in an epic journey covering,,Martin,,107288394
2019-07-02 15:24,0,1.14608E+18,1.14608E+18,,0,0,0,RT davelackie In honour of Canada Day were giving away DSquareds Wood pour Femme fragrance  a fresh woodyfloral for her with notes,,Elaine Clarke,Wrose Shipley,23469873
2019-07-02 15:24,0,1.14608E+18,1.14608E+18,,0,0,0,RT NaiimaFarah These issues have denied many in our community especially the youth in Dixon EtobicokeNorth amp across Canada educati,,Akua B,,2930468496
2019-07-02 15:24,0,1.14608E+18,1.14608E+18,,0,0,0,Good one,,penm,Saskatchewan,18631762
2019-07-02 15:24,0,1.14608E+18,1.14608E+18,,0,0,0,RT Tigergeorgie Which one of Turdeaus dual loyalty Ministers announce the arrive of an airlift of Isis Thugs amp their wives Will it b,,JTJ,Trudeaus Hell Agin,8.30793E+17
2019-07-02 15:24,0,1.14608E+18,1.14608E+18,,0,0,0,RT vansskate Happy Canada Day amp Happy Birthday to one of our favorite Canadians Leon Chapdelaine Here Leon throws down some video pa,,Chris Tan,Utah USA,1.1458E+18
2019-07-02 15:24,0,1.14608E+18,1.14608E+18,,0,0,0,Wow smh Ice is gone for good Smh,,Cafe con leche,ART,316919210
2019-07-02 15:24,0,1.14608E+18,1.14608E+18,,0,0,0,RT officialACE              ACE CHOICETOUR CANADA ,, s  ,arthurrloml  MOD,1.07325E+18
2019-07-02 15:24,0,1.14608E+18,1.14608E+18,,0,0,0,I entered the  Def Leppard Contest so can you ,,gina carofiglio,Terrebonne Qubec,140538253
2019-07-02 15:24,0,1.14608E+18,1.14608E+18,,0,0,0,Discover the largest open innovation competition in Canada tomorrow at the cooperathon info session at StartGBC ,,Social Ventures Zone,Ryerson University,2777047212
2019-07-02 15:24,0,1.14608E+18,1.14608E+18,,0,0,0,RT officialACE              ACE CHOICETOUR CANADA ,,We Are The  Choice,,3207664888
2019-07-02 15:24,0,1.14608E+18,1.14608E+18,,0,0,0,Fantastic arctic fox animal walks km from Norway to Canada,,Alex Munro,Bristol,24351125
2019-07-02 15:24,0,1.14608E+18,1.14608E+18,492660097,0,0,0,jadediva Why WONT ANYONE BRING IT UP  Or the fact she went to school in Canada  So how can she be a victim ,,Bridgets Storm ,NJ ,8.31158E+17
2019-07-02 15:24,0,1.14608E+18,1.14608E+18,,0,0,0,RT NelkFilmz Canada day shenanigans  ,,r,Winnipeg Manitoba,2374418497
2019-07-02 15:24,0,1.14608E+18,1.14608E+18,,0,0,0,RT VoteChris It was wonderful to meet so many people and celebrate our amazing country  Happy Canada Day  ,,Pete Dako,Toronto Ontario,129274292
2019-07-02 15:24,0,1.14608E+18,1.14608E+18,,0,0,0,RT CBCNews These two brothers recorded themselves singing the national anthem as a thank you to Canadians yearold Owais and yearol,,Ankit Zala,,96349739
2019-07-02 15:24,0,1.14608E+18,1.14608E+18,,0,0,0,RT AirFarceCBC The new version of the Lion King is a photorealistic remake of the original animated film Cartoons made into live action,,The Movie Project,The Island,1170897985
2019-07-02 15:24,0,1.14608E+18,1.14608E+18,,0,0,0,RT larissaandzyra People get more upset at me not celebrating Canada Day than the reasons why I dont celebrate Canada DayThat to me,,Red Thunder Woman shehercis,Blackfoot Territory,48035511
2019-07-02 15:24,0,1.14608E+18,1.14608E+18,,0,0,0,Outside Day today HMMJ  ,,SwingTradeBot Canada,,8.77191E+17
2019-07-02 15:24,0,1.14608E+18,1.14608E+18,,0,0,0,RT GeorgeHampton JustinTrudeau It appears a certain segment of our population isnt into celebrating Canada Day So much for diversity,,heath rodgirs,Edmonton Alberta,205371115
2019-07-02 15:24,0,1.14608E+18,1.14608E+18,,0,0,0,RT Andromodid  days until LorenceHud s next VERT important court date July   Lorence needs ALL your support and prayers Time,,Dana,Patriots Way USA,7.08481E+17
2019-07-02 15:24,0,1.14608E+18,1.14608E+18,,0,0,0,RT StatsGfriend GFRDofficial Fever Season Itunes Album Argentina Hong Kong Indonesia Malaysia Brazil Sweden Tu,,Pat,Hong Kong,215503164
2019-07-02 15:25,0,1.14608E+18,1.14608E+18,,0,0,0,Ni dia penyanyi band tu realFidzceterahati ceterahatidiya,,Nefertari Meritmut,Valley of the Queens,1.0557E+18
2019-07-02 15:25,0,1.14608E+18,1.14608E+18,,0,0,0,Hello Canada,,Ronaldo Amaya,El Salvador,35161163
2019-07-02 15:25,0,1.14608E+18,1.14608E+18,,0,0,0,Latvia U vs Canada U Basketball HD Stream on any Device  Jul  World Championship U ,,mathewsinhine,,1.08831E+18
2019-07-02 15:25,0,1.14608E+18,1.14608E+18,,0,0,0, oz Gold Wolf   Call of the Wild Kanada Canada   ,,Kaufe jetzt,,1408912518
2019-07-02 15:25,0,1.14608E+18,1.14608E+18,,0,0,0,RT FPVaughanIII Taking my cue from ezralevant for highlighting that the spotlight is temporarily on leftist violence which has been ali,,Adamo,,2833513650
2019-07-02 15:25,0,1.14608E+18,1.14608E+18,,0,0,0,RT susipudjiastuti Menghadiri perayaan National Day Of Canada ,,hey tayo ndasmu,,9.16886E+17
2019-07-02 15:25,0,1.14608E+18,1.14608E+18,,0,0,0,RT unseenunseen  Because of this the uniparty is forced to admit they want the  issue free trade  open borders ie no country,,Phillyshoes,Greatest Nation Ever ,132349883
2019-07-02 15:25,0,1.14608E+18,1.14608E+18,,0,0,0,RT jandles So many idiots with this takeKD KD had a  lead to GSW KD and co blew said  lead KD went and joined said team,,Black sanji ,Virginia ,167074198
2019-07-02 15:24,0,1.14608E+18,1.14608E+18,,0,0,0,During his last visit to Canada in  on the occasion of JalsaCanada inspection His Holiness Hazrat Mirza Mas ,,Jalsa Salana,,2386479459
2019-07-02 15:25,0,1.14608E+18,1.14608E+18,1.08E+18,0,0,0,cassionevesc Miltonneves JustinTrudeau jairbolsonaro Isso Mesmo o Nosso Presidente entendeu q o PM do canada ,,Claudinei dos Santos,,1.09242E+18
2019-07-02 15:25,0,1.14608E+18,1.14608E+18,,0,0,0,RT guardian Fantastic arctic fox animal walks km from Norway to Canada ,,Chris,New York USA,29451470
2019-07-02 15:25,0,1.14608E+18,1.14608E+18,,0,0,0,Dominic should be cell bound,,Herb Taplin,,714662474
2019-07-02 15:25,0,1.14608E+18,1.14608E+18,,0,0,0,RT cafreeland Delighted to welcome Ukraines President ZelenskyyUa to Canada  and to our beautiful city of Toronto  for the third U,,Zman,,494259870
2019-07-02 15:25,0,1.14608E+18,1.14608E+18,,0,0,0,RT AndrewScheer I travelled across our beautiful country today to celebrate with Canadians from coast to coast Right now Im in Kelowna,,Alien,Worldwide,9.70433E+17
2019-07-02 15:25,0,1.14608E+18,1.14608E+18,8.76E+17,0,0,0,HarryMasonDad VesnaSale Not Vietnam it North Korea or China or Canada,,Genioh,Genioh,4908732610
2019-07-02 15:25,0,1.14608E+18,1.14608E+18,,0,0,0,RT AndDagr I can attest to this  We used to have a better standard of living when we grossed as a family K a year than we have now at,,JTJ,Trudeaus Hell Agin,8.30793E+17
2019-07-02 15:25,0,1.14608E+18,1.14608E+18,,0,0,0,RT asapflamingo Im a hotel gateman and I saw my girlfriend walk in with  different guys the same nightI cant talk because I told he,,ThatNiqqaWizi,Accra Ghana Online,9.99382E+17
2019-07-02 15:25,0,1.14608E+18,1.14608E+18,,0,0,0,My Canada Day Spent Canada Day swimming canoeing and picnicking at Silent Lake Provincial Park in Ontario Ca ,,Mariellen Ward,Rishikesh India,44871646
2019-07-02 15:25,0,1.14608E+18,1.14608E+18,,0,0,0,RT chrislhayes The framing of Medicareforall as abolishing private insurance is meant to distinguish from an optional Medicare buy,,Erin Hemlin,Washington DC,324145595
2019-07-02 15:25,0,1.14608E+18,1.14608E+18,,0,0,0,RT TreeFrogNews Post Card from Zac  PLTCanada Ride across Canada ,,Project Learning Tree Canada,Canada,9.63846E+17
2019-07-02 15:25,0,1.14608E+18,1.14608E+18,,0,0,0,Rock star,,Dean Skoreyko,,94021685
2019-07-02 15:25,0,1.14608E+18,1.14608E+18,,0,0,0,I just entered for the chance to WIN  of   cash prizes to explore the world and be ReadyForAnything from Ve ,,Courtney Geddes,,7.56288E+17
2019-07-02 15:25,0,1.14608E+18,1.14608E+18,,0,0,0,RT FouldsIain ezralevant  The Liberal party are Canadas Mafia The Liberal partys true mandate is enriching and rewarding insid,,Richard Lambert,Canada,7.08908E+17
2019-07-02 15:25,0,1.14608E+18,1.14608E+18,,0,0,0,RT AylaForTrump Why does Kamala Harris want us to believe she is African American She is notIs she ashamed of being half Jamaican and,,mcclung velda,,8.20715E+17
2019-07-02 15:25,0,1.14608E+18,1.14608E+18,,0,0,0,RT KirolosSam OrenIShiKiddo realDonaldTrump ,,Tea Party Mike  Nationalist,Southern California,8.23677E+17
2019-07-02 15:25,0,1.14608E+18,1.14608E+18,,0,0,0,Amen,,JJ,,8.82488E+17
2019-07-02 15:25,0,1.14608E+18,1.14608E+18,,0,0,0,RT llewellynjobs Canada DayYou took my Mom at  years old  Put her and her siblings in residential school You took me away at birt,,Twiter  Return of the Gay,,2891323623
2019-07-02 15:25,0,1.14608E+18,1.14608E+18,166252256,0,0,0,energy canada usa usa canada saudiarabia sciam losalamosnatlab  ,,BabyAWACS KISS Chris,BabyAWACS  TRULY independent,2181045924
2019-07-02 15:25,0,1.14608E+18,1.14608E+18,,0,0,0,RT DavidLWindt The verdict is still out whether or not the honeybees are substantially impacting the native bees,,Thomas Fester,Zittau Germany,4518716163
2019-07-02 15:25,0,1.14608E+18,1.14608E+18,,0,0,0,RT guardian Fantastic arctic fox animal walks km from Norway to Canada ,,Martin,,107288394
2019-07-02 15:25,0,1.14608E+18,1.14608E+18,,0,0,0,TOMORROW Conestogas Student Engagement and CStudentsInc will cohost a Canada Day party at the Doon campus to ce ,,Conestoga College,Kitchener  Cambridge  Waterloo  Guelph  Brantford  Ingersoll,289459240
2019-07-02 15:25,0,1.14608E+18,1.14608E+18,,0,0,0,GOPACKGO,,Russ,Wisconsin USA,9.24544E+17
2019-07-02 15:25,0,1.14608E+18,1.14608E+18,,0,0,0,RT IproudCanadian mmccdenier Orkidnut sombill HomeWorldof woodytobiasii WeBldWeBuy RysaAsh anna ravenking newhandle,,dano fretman,,9.55664E+17
2019-07-02 15:25,0,1.14608E+18,1.14608E+18,,0,0,0,RT EdtheSock I was at MitzieHunters CanadaDay event It was nonpartisan nonpolitical There were NO speeches mentioning the Liberal,,Graeme Nishida,,242209509
2019-07-02 15:25,0,1.14608E+18,1.14608E+18,,0,0,0,RT NatStClair A young Arctic fox has walked across the ice from Norways Svalbard islands to northern Canada in an epic journey covering,,,waitingforErica,1.0486E+18
2019-07-02 15:25,0,1.14608E+18,1.14608E+18,,0,0,0,RT sheilawalker  might be a low estimateYYC has a  Dow town vacancy rateAll that space used to be filled granted we have taken,,Lisa,Alberta,1.08572E+18
2019-07-02 15:25,0,1.14608E+18,1.14608E+18,,0,0,0,RT lindsaymwong The reality of being called a bestselling author in Canada is five roommates three parttime jobs to support projects,,Akif Kichloo, Saginaw Michigan,276010227
2019-07-02 15:25,0,1.14608E+18,1.14608E+18,166252256,0,0,0,energy canada usa usa canada saudiarabia sciam losalamosnatlab  ,,bullshitguru,,8.61952E+17
2019-07-02 15:25,0,1.14608E+18,1.14608E+18,1.10E+18,0,0,0,Barry AJackso JoaquinCastrotx RepEscobar RepJudyChu RepPeteAguilar NormaJTorres ,,TerriMeeker,On an island in the NW,2450405498
2019-07-02 15:25,0,1.14608E+18,1.14608E+18,,0,0,0,this car commercial has something big playing in the background i luv Canada,,chanelle,n  a  t,2302236024
2019-07-02 15:25,0,1.14608E+18,1.14608E+18,,0,0,0,wa nakoy ka jamming pirme bai nilupad namans canada  aayyyVANN,,April Joyce,chixty  my muy,1333405903
2019-07-02 15:25,0,1.14608E+18,1.14608E+18,,0,0,0,RT JustinTrudeau Proud to be Canadian today and every day Happy Canada Day  ,,rod smith,,170137968
2019-07-02 15:25,0,1.14608E+18,1.14608E+18,,0,0,0,This is FrenchesqueAs in Dean just to clarifyDominic LeBlancs family friends neighbour win  of  ,,Neil Brodie,,182889119
2019-07-02 15:25,0,1.14608E+18,1.14608E+18,,0,0,0,RT Andromodid VERY  IMPORTANT  ,,Dana,Patriots Way USA,7.08481E+17
2019-07-02 15:25,0,1.14608E+18,1.14608E+18,8.85E+17,0,0,0,angie Es muy caro Air Canada y ni siquiera trae alimentos y bebidas incluidos Por algo un poco ms barato en ,,Sarah Lynn,CDMX,30883598
2019-07-02 15:25,0,1.14608E+18,1.14608E+18,,0,0,0,Between the fishing licences and the judgeships things are going pretty well for the friends relatives and neighb ,,Jason Lietaer,,257115140
2019-07-02 15:25,0,1.14608E+18,1.14608E+18,,0,0,0,RT TeamCanada ITS OFFICIALThreetime Olympic goldmedallist Marnie McBean will lead Team Canada  to Tokyo as the Chef de Mis,,carol lord,Vancouver Canada,303992124
2019-07-02 15:25,0,1.14608E+18,1.14608E+18,,0,0,0,RT NaturelsLit Wait for itHiking in Lake Louise Canada This is unreal  ,,shahad,,2943002436
2019-07-02 15:25,0,1.14608E+18,1.14608E+18,,0,0,0,Bank of Canada partners with private sector to strengthen cyber security ,,CentralBankingcom,London UK,166186963
2019-07-02 15:25,0,1.14608E+18,1.14608E+18,,0,0,0,This is exactly the job of the political cartoonist  pointing out the stupidity and puncturing the posturing and ,,Bosun Arras,Here,7.62635E+17
2019-07-02 15:25,0,1.14608E+18,1.14608E+18,,0,0,0,RT whereismarktuan Toronto Canada  Dallas USA MarkTuan,,Mark Tuan ,,9.32862E+17
2019-07-02 15:25,0,1.14608E+18,1.14608E+18,,0,0,0,RT FaridaN Renowned Congolese pastor Paul Mukendi was found guilty of  charges of sexual assaults in Canada His victim a young woman,,Tolulope AdeleruBalogun,Nigeria,194607562
2019-07-02 15:25,0,1.14608E+18,1.14608E+18,,0,0,0,RT NatStClair A young Arctic fox has walked across the ice from Norways Svalbard islands to northern Canada in an epic journey covering,,cookie madden cookz,Decatur AL,625316512
2019-07-02 15:25,0,1.14608E+18,1.14608E+18,9.16E+17,0,0,0,GlenLandgren CardsFromAttic Canada Day Hangover I dont think I qualify for president though ,,Tyson,,3185218114
2019-07-02 15:25,0,1.14608E+18,1.14608E+18,,0,0,0,RT simminee Okkkkkk Successfully completed my first solo international show for KaboomNation in a country Ive never been before,,John Wicked,Bridge Views,2214870006
2019-07-02 15:25,0,1.14608E+18,1.14608E+18,,0,0,0,Many Canadians want to donate blood in Canada but are BANNED due to being gay bi or transgender This is homopho ,,Brian Appel,Victoria British Columbia,9.73491E+17
2019-07-02 15:25,0,1.14608E+18,1.14608E+18,,0,0,0,RT earthvisuals Alberta Canada ,,Alvi ,Barranquilla Colombia,8.45851E+17
2019-07-02 15:25,0,1.14608E+18,1.14608E+18,,0,0,0,RT kaylareadsbook K GIVEAWAYHow to enter RT Follow and Like For extra entry Follow me on Instagram and do what it says there US,,D O N N  ,Canada  WPG,88340941
2019-07-02 15:25,0,1.14608E+18,1.14608E+18,,0,0,0,RT itchfaceclinton IDirtlump barbarastarr smfehir anna ravenking newhandle HappyintheWest UpKeeks angelangulus Alzer,,Mr fehir ambulance chaser ,ONTARIO Open For Business,2367926209
2019-07-02 15:25,0,1.14608E+18,1.14608E+18,,0,0,0,RT chuenchiwamom NewarkTinder Toronto My moose  Canadas son Whats next ,,nanajittang,,1.11447E+18
2019-07-02 15:25,0,1.14608E+18,1.14608E+18,,0,0,0,RT nobyrnelaw As a law professor I have done dozens of interviews with Brunswick News reporters over the past  years I will no longer,,Maurine Karagianis,Victoria BC,17394737
2019-07-02 15:25,0,1.14608E+18,1.14608E+18,,0,0,0,RT llewellynjobs Canada DayYou took my Mom at  years old  Put her and her siblings in residential school You took me away at birt,,Conor Armstrong,South West England,467908070
2019-07-02 15:25,0,1.14608E+18,1.14608E+18,,0,0,0,RT ShawnMendes Happy Canada day I love Canada   ,,Magali Garcia,Villa Gobernador Glvez Argen,8.27263E+17
2019-07-02 15:25,0,1.14608E+18,1.14608E+18,,0,0,0,mmmm diabetes in a bottle ILOVEYOUCANADA,,WeAreHive SONS,PARTS UNKNOWN,8.02923E+17
2019-07-02 15:25,0,1.14608E+18,1.14608E+18,,0,0,0,Nepotism perhapscdnpoliappointments,,ONB Conservatives,Oakville Ontario,4837277085
2019-07-02 15:25,0,1.14608E+18,1.14608E+18,,0,0,0,RT IranianForum Iranian Canadian Congress ICCongress which is NIACs sister organization in Canada has been handed a resounding humi,,malai,,9.74173E+17
2019-07-02 15:25,0,1.14608E+18,1.14608E+18,,0,0,0,RT Ballislife Happy Canada Day  ,,Blue Rain Mitch,,55160031
2019-07-02 15:25,0,1.14608E+18,1.14608E+18,,0,0,0,RT MookKhaimuk      ,,,,8.2291E+17
2019-07-02 15:25,0,1.14608E+18,1.14608E+18,,0,0,0,A successful Canada day weekend with my favourite people ,,Taya Carlson,,4497686968
2019-07-02 15:25,0,1.14608E+18,1.14608E+18,,0,0,0,RT PureShakti CDNpoli  Tell Trudeau not to ratify NAFTA  because we must follow Democrats lead not Trumps Also in elxn on,,emgfind,Alberta Canada,2925571294
2019-07-02 15:25,0,1.14608E+18,1.14608E+18,,0,0,0,RT dbcdcb EnCeJour  nat Charles Tupper mdecin et homme politique  brivement premier ministre du Canada du er mai au  juillet,,Chris Alexander,Ajax Canada,76918775
2019-07-02 15:25,0,1.14608E+18,1.14608E+18,,0,0,0,RT NatStClair A young Arctic fox has walked across the ice from Norways Svalbard islands to northern Canada in an epic journey covering,,JC,,280862521
2019-07-02 15:25,0,1.14608E+18,1.14608E+18,,0,0,0,Suicide prevention curriculum gives students tools to thrive not just survive  CBC News ,,ON Peer Development,Toronto,56875450
2019-07-02 15:25,0,1.14608E+18,1.14608E+18,,0,0,0,Hello SirWe need your kind advice on one issue our son he has PR in Canada and he works in Canada he had studi ,,Jangam Nakul CShekh,MulundWMumbai,582653071
2019-07-02 15:25,0,1.14608E+18,1.14608E+18,,0,0,0,RT rdtimewalter There ya go The Evangelists have arrived in Canada ,,Concerned Citizen,,8.96054E+17
2019-07-02 15:25,0,1.14608E+18,1.14608E+18,,0,0,0,This little ladys incredible journey from Norway to Canada highlights both how hardy wildlife can be and how vital ,,Catherine McKenna,Fredericton New Brunswick,1.13919E+18
2019-07-02 15:25,0,1.14608E+18,1.14608E+18,,0,0,0,LET HIM HIKE,,,Baltimore MD,2445297285
2019-07-02 15:25,0,1.14608E+18,1.14608E+18,,0,0,0,Kan best kalau gaji graduan lebih tinggi daripada germany israel qatar uk seperti kemahiran mereka,,abdul rahman,,170658171
2019-07-02 15:25,0,1.14608E+18,1.14608E+18,,0,0,0,Influences chinoises et amricaines au G  entrevue avec FredericMerand  heuredumonde  ,,CRIUM,Montral  Qubec  Canada,1470509497
2019-07-02 15:25,0,1.14608E+18,1.14608E+18,,0,0,0,RT jandles So many idiots with this takeKD KD had a  lead to GSW KD and co blew said  lead KD went and joined said team,,Michael T,Somewhere in texas grinding,7.56885E+17
2019-07-02 15:25,0,1.14608E+18,1.14608E+18,,0,0,0,RT davelackie In honour of Canada Day were giving away DSquareds Wood pour Femme fragrance  a fresh woodyfloral for her with notes,,Marie Cornwall,,58648516
2019-07-02 15:25,0,1.14608E+18,1.14608E+18,,0,0,0,Are you a business that does business in other provinces of Canada  smallbiz ,,Cathy Cornelius,Dartmouth Nova Scotia,7.7285E+17
2019-07-02 15:25,0,1.14608E+18,1.14608E+18,,0,0,0,RT DublinAirport Win flights to Canada with AirCanada to any of their  destinations from DublinAirport To enter just follow amp retweet,,Aida B,Ireland,130108120
2019-07-02 15:25,0,1.14608E+18,1.14608E+18,1.13E+18,0,0,0,SophieB Canada never had slavery Anything you see that says otherwise is MISINFORMATION Britain abolishe ,,NJoseph PhD,Toronto Ontario,7.35148E+17
2019-07-02 15:25,0,1.14608E+18,1.14608E+18,,0,0,0,RT jandles So many idiots with this takeKD KD had a  lead to GSW KD and co blew said  lead KD went and joined said team,,KingRavi,Pakistan,372056289
2019-07-02 15:25,0,1.14608E+18,1.14608E+18,,0,0,0,RT NatStClair A young Arctic fox has walked across the ice from Norways Svalbard islands to northern Canada in an epic journey covering,,Sanda Blue,NYC exile in humid climes,2422702611
2019-07-02 15:25,0,1.14608E+18,1.14608E+18,,0,0,0,RT AnnTelnaes The US editorial cartoonists are also antistupid  Of course there have always been some who identify with a political,,rosesauthor,United StatesCanada,16445528
2019-07-02 15:25,0,1.14608E+18,1.14608E+18,,0,0,0,Penske Truck Leasing is hiring in Boucherville Quebec Canada Read about our latest BusinessMgmt job opening via ,,TMJQBC Jobs,Quebec,38118955
2019-07-02 15:25,0,1.14608E+18,1.14608E+18,,0,0,0,RT BashirMohamed The extent to which blacks and Aboriginals are over represented in Canadian correctional institutions is similar to tha,,,United States,3853395694
2019-07-02 15:25,0,1.14608E+18,1.14608E+18,,0,0,0,RT perspupu  ,,Joonas Linkola,Helsinki Finland,20624036
2019-07-02 15:25,0,1.14608E+18,1.14608E+18,,0,0,0,RT jonassiegel I would love us to be the most skilled and the biggest and the grittiest team going But talent will come first On Cana,,STEE BOZIC,T ,21769361
2019-07-02 15:25,0,1.14608E+18,1.14608E+18,,0,0,0,RT DublinAirport Win flights to Canada with AirCanada to any of their  destinations from DublinAirport To enter just follow amp retweet,,Aaron S,Dublin,22910535
2019-07-02 15:25,0,1.14608E+18,1.14608E+18,,0,0,0,Canada has added  million jobs since  Yeah and weve added  million people over the same period The ,,Simon Leblanc,Raptors bandwagon,1.09915E+18
2019-07-02 15:25,0,1.14608E+18,1.14608E+18,,0,0,0,RT ShawnMendes Happy Canada day I love Canada   ,,madeline,,1.12773E+18
2019-07-02 15:25,0,1.14608E+18,1.14608E+18,,0,0,0,RT iguinorem o mundo podia ser todo assim se vocs no ficassem jogando lixo em tudo quanto  lugar SEUS ARROMBADOS DO CARALHO ,,Aeroporto mental,,3798079707
2019-07-02 15:25,0,1.14608E+18,1.14608E+18,215976906,0,0,0,SuzanneLeonard Trusting you had a great Canada Day Suzanne lady avec the curlsWarm regards,,James  Workman,ArcolaSaskatchewan,200761427
2019-07-02 15:25,0,1.14608E+18,1.14608E+18,,0,0,0,RT Deneze Northerners have more in common travelling eastwest than northsouth we are more connected up here than people realize ,,pihtawikosisn,amiskwacwskahikanihk,478823758
2019-07-02 15:25,0,1.14608E+18,1.14608E+18,,0,0,0,Vietnam North Korea China and Canada,,Genioh,Genioh,4908732610
