created_at,favorite_count,id,id_str,in_reply_to_user_id_str,quote_count,reply_count,retweet_count,text,withheld_in_countries,name,location,UID
2019-07-02 15:30,0,1.14608E+18,1.14608E+18,,0,0,0,RT GypsySpirit TNorrisNU And a Happy Canada to you too   ,,Joanna   ,Canada ,24597757
2019-07-02 15:30,0,1.14608E+18,1.14608E+18,,0,0,0,RT palevell CBCPolitics It appears that CBCPolitics somehow missed the leader of the fastestgrowing political party in Canada  To rea,,Keepit Straight Mungo,Canada,1.1135E+18
2019-07-02 15:30,0,1.14608E+18,1.14608E+18,,0,0,0,RT whereismarktuan Toronto Canada  Dallas USA MarkTuan,,,XCIIIXCVII,1926660001
2019-07-02 15:30,0,1.14608E+18,1.14608E+18,,0,0,0,The Forks is wellknown as a historic meeting place for Manitobans and the  Canada Day celebrations carried on ,, CJOB,Winnipeg Manitoba,31220292
2019-07-02 15:30,0,1.14608E+18,1.14608E+18,,0,0,0,Canada   Despite a strong economy cost of living still top of mind for Canadians ,,Telesphore Teta,DOUALA,350990667
2019-07-02 15:30,0,1.14608E+18,1.14608E+18,,0,0,0,RT AylaForTrump Why does Kamala Harris want us to believe she is African American She is notIs she ashamed of being half Jamaican and,,KAG Four More Years,North Carolina,2618573184
2019-07-02 15:30,0,1.14608E+18,1.14608E+18,,0,0,0,RT RunADZ  ,, days until Jimmy G returns,,7.57009E+17
2019-07-02 15:30,0,1.14608E+18,1.14608E+18,,0,0,0,RT ensscnapoli Oh Canada Happy Canada Day to all  Canadians especially our supporters Enjoy such a special day ,,Alberto Giuliano,Napoli,1174859690
2019-07-02 15:30,0,1.14608E+18,1.14608E+18,,0,0,0,Oh  CanadaMosquitoes blackflies stilllovely ,,Helena Moncrieff,,150754461
2019-07-02 15:30,0,1.14608E+18,1.14608E+18,,0,0,0,TK was a big pump by  IKN,,RocketRed,wildrose country,3070284265
2019-07-02 15:30,0,1.14608E+18,1.14608E+18,,0,0,0,Know Truth More  Poland Ukraine Belarus Czech Slovakia Romania Finland Canada Greece Turkey,,PostsfromAsia,Entire Asia,3303099121
2019-07-02 15:30,0,1.14608E+18,1.14608E+18,,0,0,0,RT Reuters A group called Caravan to Canada traveled from Minneapolis Minnesota and stopped at London Ontario seeking affordable pric,,Trading News,London England,9.80874E+17
2019-07-02 15:30,0,1.14608E+18,1.14608E+18,,0,0,0,On a threeday weekend with my family celebrating our first Canada Day when a major plot change for my WIP pops ,,C Jean Downer,Greater Vancouver,1.04323E+18
2019-07-02 15:30,0,1.14608E+18,1.14608E+18,,0,0,0,RT jandles So many idiots with this takeKD KD had a  lead to GSW KD and co blew said  lead KD went and joined said team,,Christian Bale,HTown ,1202360586
2019-07-02 15:30,0,1.14608E+18,1.14608E+18,,0,0,0,RT vickysanderson Today I saw an Indigenous woman putting a poster about MMIW on a statue of Macdonald at Queens Park get handcuffed,,Chelsea,Unceded territory,270460963
2019-07-02 15:30,0,1.14608E+18,1.14608E+18,,0,0,0,RT kshahrooz  Recently a number of activists began a legal action against the ICCongress on the simple basis that in Canada members,,SieteBit,London England,1852421136
2019-07-02 15:30,0,1.14608E+18,1.14608E+18,,0,0,0,RT bgmotogp Happy Canada Day  ,,Bayu Khrisna,,1.0916E+18
2019-07-02 15:30,0,1.14608E+18,1.14608E+18,,0,0,0,RT cnni A young female Arctic fox has shocked scientists by traveling over  km  miles from Norway to Canada in just  days,,Tunde Akingbulugbe,,7.54371E+17
2019-07-02 15:30,0,1.14608E+18,1.14608E+18,,0,0,0,RT InYourFaceFilms Here isrusthxc Hard LuckJune  Toronto Ontario CanadaLink in Bio ,,Elliott Cohen,Connecticut USA,1340724564
2019-07-02 15:30,0,1.14608E+18,1.14608E+18,,0,0,0,RT LillaBleu FLORIDA LAWS NOW IN AFFECT Bright Futures scholarship requirements are now tougher SB  Cheaper drugs are now bei,,les ,,1486093190
2019-07-02 15:30,0,1.14608E+18,1.14608E+18,,0,0,0,RT doubledayca Theres no more appropriate way to celebrate CanadaDay than by giving the gift of the greatest Canadabased literary thr,,mutti bruch,canada,19875456
2019-07-02 15:30,0,1.14608E+18,1.14608E+18,,0,0,0,RT DrinkReeds Turns out theres almost no ginger in Canada Dry Ginger Ale Reeds is packed with fresh REAL gingerand lots of it,,Lapithan Quinazuli ,Belleville NJ,3731081428
2019-07-02 15:30,0,1.14608E+18,1.14608E+18,,0,0,0,RT GreedyDomme  HAPPY CANADA DAY  ,,RT Findom Brats,findomheaven,1.11865E+18
2019-07-02 15:30,0,1.14608E+18,1.14608E+18,,0,0,0,RT guardian Fantastic arctic fox animal walks km from Norway to Canada ,,Karam Singh,California,632705547
2019-07-02 15:30,0,1.14608E+18,1.14608E+18,,0,0,0,RT davelackie In honour of Canada Day were giving away DSquareds Wood pour Femme fragrance  a fresh woodyfloral for her with notes,,Priscilla,USA,2742774975
2019-07-02 15:30,0,1.14608E+18,1.14608E+18,3003681606,0,0,0,sidedpankcake CTVNews Trudeau is selling Canada out to globalism while Trump and family are restoring pride in t ,,Cyrus,,4546882335
2019-07-02 15:30,0,1.14608E+18,1.14608E+18,8.41E+17,0,0,0,PainterMom CBCTheHouse chrishallcbc Yes of course Sorry it was left out CBC News The House with Chris Hal ,,Matthew Pearson,Ottawa ON,43946429
2019-07-02 15:30,0,1.14608E+18,1.14608E+18,,0,0,0,RT ShawnMendes Happy Canada day I love Canada   ,,CERES,Granada Espaa,2537223603
2019-07-02 15:30,0,1.14608E+18,1.14608E+18,,0,0,0,,,Judy Croon,Toronto Ontario,241288147
2019-07-02 15:30,0,1.14608E+18,1.14608E+18,,0,0,0,RT NatStClair A young Arctic fox has walked across the ice from Norways Svalbard islands to northern Canada in an epic journey covering,,Dash Forester,Saline MI,54501332
2019-07-02 15:30,0,1.14608E+18,1.14608E+18,,0,0,0,RT sergeibaka Happy Canada Day to all Canadians Raptors fans and lovers of this great country ,,Sandra Benvenuto,Toronto Ontario,163590961
2019-07-02 15:30,0,1.14608E+18,1.14608E+18,,0,0,0,RT kshahrooz  Recently a number of activists began a legal action against the ICCongress on the simple basis that in Canada members,,Azad Azadisetan,,1.11147E+18
2019-07-02 15:30,0,1.14608E+18,1.14608E+18,,0,0,0,Volunteers from the Lynn Valley Lions Club were up at the crack of dawn to prepare a pancake breakfast for thousand ,,TshirtPrintingCo,Vancouver,294191526
2019-07-02 15:30,0,1.14608E+18,1.14608E+18,,0,0,0,RT DublinAirport Win flights to Canada with AirCanada to any of their  destinations from DublinAirport To enter just follow amp retweet,,mark lincoln,,231766308
2019-07-02 15:30,0,1.14608E+18,1.14608E+18,,0,0,0,RT yvonnetn Quote by De Adder The Irvings dont want Justin Trudeau reelected and they will not print a cartoo,,Carolyn,,8.53722E+17
2019-07-02 15:30,0,1.14608E+18,1.14608E+18,,0,0,0,BC man says he performed CPR on unconscious and recently orphaned bear cub  CBC News ,,Edith LoringKuhanga,Victoria British Columbia,140985152
2019-07-02 15:30,0,1.14608E+18,1.14608E+18,,0,0,0,RT WalderSports But Canada loves its hockey Sure but  ,,Marc Griffin,,77673965
2019-07-02 15:30,0,1.14608E+18,1.14608E+18,,0,0,0,Bouleversement du climatet des assurancesFroid  intense froid intense suivi de pluie verglas t de sch ,,CRE Montrgie,Longueuil Qubec,8.69561E+17
2019-07-02 15:30,0,1.14608E+18,1.14608E+18,,0,0,0,RT afcanavera Canada Day fireworks timelapse  YEG Fireworks CanadaDay Timelapse RJSCity JaredCandlish CBCEdmonton doniveson htt,,Stephen Raitz,,9.8916E+17
2019-07-02 15:30,0,1.14608E+18,1.14608E+18,,0,0,0,wef Canada and the Netherlands along with Accenture unveiled a new pilot project which will enable people to t ,,Accenture Travel,Global,3836299941
2019-07-02 15:30,0,1.14608E+18,1.14608E+18,,0,0,0,RT kevpluck Huge disintegration of sea ice in the Beaufort Sea north of Canada and Alaska ,,AltUSARC,The Resistance,8.24339E+17
2019-07-02 15:30,0,1.14608E+18,1.14608E+18,13393052,0,0,0,ACLU Go try to sneak into Canada and let me know how that goes for you They detain newborns at the border They j ,,BXChic,Bklyn,8.67441E+17
2019-07-02 15:30,0,1.14608E+18,1.14608E+18,817349780,0,0,0,abiddulph smfehir IproudCanadian mmccdenier Orkidnut sombill HomeWorldof woodytobiasii WeBldWeBuy ,,Mike Damage,Internet,94259742
2019-07-02 15:30,0,1.14608E+18,1.14608E+18,,0,0,0,RT earthvisuals Alberta Canada ,,Kiwy,,1.06919E+18
2019-07-02 15:30,0,1.14608E+18,1.14608E+18,,0,0,0,RT TouchwoodPR We are celebrating  years of FANEXPOCANADA Join the celebration with events across the city including Pride Torontos,,Liz,NEVERLAND,1.07397E+18
2019-07-02 15:30,0,1.14608E+18,1.14608E+18,,0,0,0,RT VancityReynolds Happy Birthday to my  year old lover Canada  CanadaDay,,Lydia,,247383368
2019-07-02 15:30,0,1.14608E+18,1.14608E+18,,0,0,0,Canadas Most Beautiful Gardens ,,DorisMaria Heilmann,North America,505732940
2019-07-02 15:30,0,1.14608E+18,1.14608E+18,,0,0,0,RT DublinAirport Win flights to Canada with AirCanada to any of their  destinations from DublinAirport To enter just follow amp retweet,,Niamh McCann,Fear Manach Ireland ,259440578
2019-07-02 15:30,0,1.14608E+18,1.14608E+18,,0,0,0,Very cool,,Ellen,Ontario Canada,257244279
2019-07-02 15:30,0,1.14608E+18,1.14608E+18,,0,0,0,RT JackPosobiec Arctic fox tracked walking from Norway to CanadaGuess those polar ice caps are still working after all ,,STEE BOZIC,T ,21769361
2019-07-02 15:30,0,1.14608E+18,1.14608E+18,,0,0,0,Geoffrey Canada There is no Superman to save our kids so we need to save our kids asca ,,Siobhan Barber,Vermont USA,35621290
2019-07-02 15:30,0,1.14608E+18,1.14608E+18,,0,0,0,RT kshahrooz  The ICCongress refused to release the list in clear and obvious contravention of the law  They made up excuses about pr,,Azad Azadisetan,,1.11147E+18
2019-07-02 15:30,0,1.14608E+18,1.14608E+18,,0,0,0,RT NatStClair A young Arctic fox has walked across the ice from Norways Svalbard islands to northern Canada in an epic journey covering,,julie hunt,Frodsham England,2724548170
2019-07-02 15:30,0,1.14608E+18,1.14608E+18,,0,0,0,RT RichKlafki Pretty hard to beat natures fireworks display on Canada Day in the backcountry of the Rocky Mountainscanadianrockies na,,David Mayhood,Calgary AB Canada,737378468
2019-07-02 15:30,0,1.14608E+18,1.14608E+18,,0,0,0,RT VancityReynolds Happy Birthday to my  year old lover Canada  CanadaDay,,Glenn Cuthbertson,Toronto Ontario,8.29849E+17
2019-07-02 15:30,0,1.14608E+18,1.14608E+18,,0,0,0,RT HaveWeAllGoneM The crisis with Iran shows why the world needs Canadas energy J Berkshire Miller and Irfan Yar in the National Post,,S,Ontario Canada,2752690217
2019-07-02 15:30,0,1.14608E+18,1.14608E+18,43633246,0,0,0,EdtheSock mmofcan MitzieHunter globalnews GlobalRegina Ive recently started seeing a pattern of smearing the ,,Riderette,,7.13797E+17
2019-07-02 15:30,0,1.14608E+18,1.14608E+18,,0,0,0,TriviaMardi Linsigne du Corps des transmissions royal du Canada porte en son centre le dieu romain Mercure Quel ,,rdCanadianDivision,Western Canada,136339305
2019-07-02 15:30,0,1.14608E+18,1.14608E+18,,0,0,0,RT NatStClair A young Arctic fox has walked across the ice from Norways Svalbard islands to northern Canada in an epic journey covering,,Karate Leonard,Toronto Ontario,4804495100
2019-07-02 15:30,0,1.14608E+18,1.14608E+18,,0,0,0,RT OracolX Happy Canada Day Long Weekend  ,,Vjatri,Amritsar,9.91017E+17
2019-07-02 15:30,0,1.14608E+18,1.14608E+18,,0,0,0,RT NatStClair A young Arctic fox has walked across the ice from Norways Svalbard islands to northern Canada in an epic journey covering,,temperance brennan,,1613493882
2019-07-02 15:30,0,1.14608E+18,1.14608E+18,,0,0,0,PROTECT YOUR HOME  WalleCover We Got You Covered   SECURE YOURS TODAY  KEEP WILDLIFE OUT   ,,Oakville Deal Finder,Oakville Ontario,2851898445
2019-07-02 15:30,0,1.14608E+18,1.14608E+18,,0,0,0,RT DearAuntCrabby Seriously WTF ,,Jill Miller,Illinois USA,519152441
2019-07-02 15:30,0,1.14608E+18,1.14608E+18,,0,0,0,RT deAdder This is the newspaper  chronicleherald I still do work for in Atlantic Canada as part of the SaltWireNetwork  They deserve,,John DeMont,Halifax Nova Scotia Canada,381604599
2019-07-02 15:30,0,1.14608E+18,1.14608E+18,,0,0,0,Area of BC home to some of Canadas most endangered species closer to becoming a national park ,, ,London England,740459431
2019-07-02 15:30,0,1.14608E+18,1.14608E+18,,0,0,0,RT NatStClair A young Arctic fox has walked across the ice from Norways Svalbard islands to northern Canada in an epic journey covering,,Ginger,Lothian,1849296343
2019-07-02 15:30,0,1.14608E+18,1.14608E+18,,0,0,0,Happy Tuesday GuysIm certainly recovering from the long weekend hope you all had a wonderful Canada day Guess w ,,VANISHA,Ontario Canada,140040592
2019-07-02 15:30,0,1.14608E+18,1.14608E+18,,0,0,0,No I dont want to go for some insane record  Its the one time of year where its actually nice outside in Canada ,,OG,Toronto Ontario,1.06279E+18
2019-07-02 15:30,0,1.14608E+18,1.14608E+18,,0,0,0,Raposa fez viagem em tempo record entre a Noruega e o Canad sapo ,,SAPO,Portugal,14842285
2019-07-02 15:30,0,1.14608E+18,1.14608E+18,,0,0,0,PROTECT YOUR HOME  WalleCover We Got You Covered   SECURE YOURS TODAY  KEEP WILDLIFE OUT   ,,Miami Deal Finder,Miami FL,4839918723
2019-07-02 15:30,0,1.14608E+18,1.14608E+18,8.44E+17,0,0,0,OurCommons un TheDemocrats HouseDemocrats SenateDems,,Paul Terrett Smith,Nanaimo British Columbia,9.5638E+17
2019-07-02 15:30,0,1.14608E+18,1.14608E+18,,0,0,0,RT kamalhothi A young Arctic fox has walked across the ice from Norways Svalbard islands to northern Canada in an epic journey coveri,,Karam Singh,California,632705547
2019-07-02 15:30,0,1.14608E+18,1.14608E+18,,0,0,0,RT VancouverSun An Arctic fox walked from Norway to Canada in just  days Thats  km three countries and two continents ,,Jameel Aziz,Kamloops British Columbia,217224863
2019-07-02 15:30,0,1.14608E+18,1.14608E+18,,0,0,0,RT BradWestPoCo Challenges    s held hostage bogus charges that mean death havent seen family or lawyer boycott of  canolameat,,Dave,,20394792
2019-07-02 15:30,0,1.14608E+18,1.14608E+18,,0,0,0,RT AylaForTrump Why does Kamala Harris want us to believe she is African American She is notIs she ashamed of being half Jamaican and,,ConservativeKandiCA,United States of America ,1164705565
2019-07-02 15:30,0,1.14608E+18,1.14608E+18,1.11E+18,0,0,0,kabayanyuta nagdrive ng mabagalKUMUSTA BESPREN HOWS CANADA,,moan taeil,moon taeil,1.12175E+18
2019-07-02 15:30,0,1.14608E+18,1.14608E+18,,0,0,0,RT BridgetKF jadediva Why WONT ANYONE BRING IT UP  Or the fact she went to school in Canada  So how can she be a victim of the,,Marie,new jersey,2179916998
2019-07-02 15:30,0,1.14608E+18,1.14608E+18,,0,0,0,RT BashirMohamed A few years ago I was sitting in the parking lot of Northgate mall with my mom It was after my first year of university,,Jesse Kurtz,Lethbridge Alberta Canada,317948232
2019-07-02 15:30,0,1.14608E+18,1.14608E+18,,0,0,0,RT safizizir Game DayRdv  h sur france XVDEFRANCEFEMININ rugbyfeminin rugbywomen rugby france canada sandiego fran,,RugbyMontpellier,Montpellier France,3774579268
2019-07-02 15:30,0,1.14608E+18,1.14608E+18,,0,0,0,RT jandles So many idiots with this takeKD KD had a  lead to GSW KD and co blew said  lead KD went and joined said team,,BAN,  germany    Cali ,999950893
2019-07-02 15:30,0,1.14608E+18,1.14608E+18,,0,0,0,RT GordonGChang There is only one thing that will end Beijings atrocities against the Uighurs the fall of the Communist Party And the,,Laura Melvin,Knoxville IL,429957546
2019-07-02 15:30,0,1.14608E+18,1.14608E+18,,0,0,0,RT rexglacer Is there anything this Liberal media doesnt hate about Canada This is nothing but pathetic pandering to Trudeaus motivati,,mser,Canada,1.09435E+18
2019-07-02 15:30,0,1.14608E+18,1.14608E+18,,0,0,0,RT ellhah Canada Day is still going strong  so is the Canadian RampB music scene Dont sleep on our artists  ,,St Sucia ,Turtle Island,601602005
2019-07-02 15:30,0,1.14608E+18,1.14608E+18,,0,0,0,canada day nga pala ngayon ,,,,1701101748
2019-07-02 15:30,0,1.14608E+18,1.14608E+18,,0,0,0,Personne pour chanter  Happy days amp pour un selfie Personne  qui montrer ses bas   Trump se fout du Valseur ,, ,,1.03525E+18
2019-07-02 15:30,0,1.14608E+18,1.14608E+18,1.11E+18,0,0,0,Corey Maidafloat DailyMirror PhilipHammondUK educationgovuk PEI CanadaWe were told media here will ,,Toby MacDonald,Summerside,2740825529
2019-07-02 15:30,0,1.14608E+18,1.14608E+18,,0,0,0,RT Rainmaker This is the visual representation of the path of a young arctic fox that walked across the ice from Norways Svalbard is,,JMo City,,1554857544
2019-07-02 15:30,0,1.14608E+18,1.14608E+18,,0,0,0,RT MStrooo HAPPY CANADA DAY to this beautiful country ,,MiSh NBA CHAMPIONS TORONTO RAPTORS,The ix,582057156
2019-07-02 15:30,0,1.14608E+18,1.14608E+18,,0,0,0,RT bcbluecon Rock star ,,Frank P,,261055378
2019-07-02 15:30,0,1.14608E+18,1.14608E+18,,0,0,0,RT hennis WeAreCanProud JustinTrudeau AaronGunn We know conservatives dont believe in true reconciliation as part of that is reco,,Hope,,1587277334
2019-07-02 15:30,0,1.14608E+18,1.14608E+18,,0,0,0,RT Rainmaker This is the visual representation of the path of a young arctic fox that walked across the ice from Norways Svalbard is,,Bori Kiss,East Sheen London UK,14367756
2019-07-02 15:30,0,1.14608E+18,1.14608E+18,,0,0,0,RT kinsellawarren This is actually a major story Will be interesting to see where it goes Dominic LeBlancs family friends neighbour,,Dknow,,391122868
2019-07-02 15:30,0,1.14608E+18,1.14608E+18,49701099,0,0,0,So much rain in fact that a special weather statement has been issued just for it,,CBC Windsor,Windsor Ontario,49701099
2019-07-02 15:30,0,1.14608E+18,1.14608E+18,,0,0,0,RT DublinAirport Win flights to Canada with AirCanada to any of their  destinations from DublinAirport To enter just follow amp retweet,,Andrew Ennis,Dublin,402069530
2019-07-02 15:30,0,1.14608E+18,1.14608E+18,,0,0,0,RT Canada For those who wonder why this happened Unfortunately our REAL history is no longer taught in school  Canada ,,Bob the Work Boot,,1.14118E+18
2019-07-02 15:30,0,1.14608E+18,1.14608E+18,,0,0,0,RT ASLuhn Arctic fox ran with tracking collar ran  miles across the ice from Norway Svalbard to Canada in only  months Arctic,,dux catcanine,A lucky place if still here,3036889249
2019-07-02 15:30,0,1.14608E+18,1.14608E+18,,0,0,0,RT IDirtlump HaveWeAllGoneM On the radio I heard Calgary Canada Day celebrations were going on and the ones they mentioned were a franc,,Whats Goin On,Western Canada,38212314
2019-07-02 15:30,0,1.14608E+18,1.14608E+18,,0,0,0,RT kshahrooz  And of course the ICCongress has been an abject failure in achieving any of its policy goals  Their stated goal of j,,Azad Azadisetan,,1.11147E+18
2019-07-02 15:30,0,1.14608E+18,1.14608E+18,,0,0,0,RT BruceAHeyman HappyCanadaDay  ,,Council of American Ambassadors,Washington DC,1.1385E+18
2019-07-02 15:30,0,1.14608E+18,1.14608E+18,,0,0,0,RT youhadonejob When youre American and you bake a cake for your Canadian friends for Canada day  CanadaDay ,,Isaac Rosenthal,,4861763397
2019-07-02 15:30,0,1.14608E+18,1.14608E+18,,0,0,0,RT WalderSports But Canada loves its hockey Sure but  ,,Khudija A,Born Raised  Raising in the ,352164271
2019-07-02 15:30,0,1.14608E+18,1.14608E+18,,0,0,0,RT CREWcrew G countries where Ivanka Trump has registered trademarks Australia Brazil Canada China France Germany India Indones,,mrs dunphy,DFW area,803357718
2019-07-02 15:30,0,1.14608E+18,1.14608E+18,,0,0,0,RT nobyrnelaw As a law professor I have done dozens of interviews with Brunswick News reporters over the past  years I will no longer,,Keith Baldrey,Victoria BC,228529107
2019-07-02 15:30,0,1.14608E+18,1.14608E+18,,0,0,0,RT DublinAirport Win flights to Canada with AirCanada to any of their  destinations from DublinAirport To enter just follow amp retweet,,Saoirse Moriarty,Ireland,555351634
2019-07-02 15:30,0,1.14608E+18,1.14608E+18,,0,0,0,Tsilhqotin Nation plans peaceful action to protect two sacred lakes from mining  CBC News ,,Richard Herbert,Fredericton New Brunswick,1855087903
2019-07-02 15:30,0,1.14608E+18,1.14608E+18,,0,0,0,RT MayorBowman Hip hop is alive and well in Canada and in the heart of the exchangedistrict Happy to check out Northern Touch Music F,,Honey Dillionaires,,7.42144E+17
2019-07-02 15:30,0,1.14608E+18,1.14608E+18,262471147,0,0,0,matracaberg It is why I moved to the Pacific Northwest The high is  today in Bellingham WA  And its  mi ,,Wanderingamylessly,Mill Creek WA,95320810
2019-07-02 15:30,0,1.14608E+18,1.14608E+18,,0,0,0,RT QasimRashid This is a  month insulin prescriptionWhen the Right says we cant afford Medicare for all what they mean is we bill,,Marlton Octavious,,42543365
2019-07-02 15:30,0,1.14608E+18,1.14608E+18,,0,0,0,,,Believe in Canada,,3540035236
2019-07-02 15:30,0,1.14608E+18,1.14608E+18,,0,0,0,RT emgfind O Canada  ,,emgfind,Alberta Canada,2925571294
2019-07-02 15:30,0,1.14608E+18,1.14608E+18,,0,0,0,  guess these fools never watched Planet of the Apes,,David Huey,Atlanta GA,17343928
2019-07-02 15:30,0,1.14608E+18,1.14608E+18,,0,0,0,I need to go fr,,GyalAhSicario ,,1.14196E+18
2019-07-02 15:30,0,1.14608E+18,1.14608E+18,,0,0,0,How much you need for a down payment The Government of Canada laid it out quite clearly here ,,Benchmark Mortgages,Members of the M Mortgage Group,553273650
2019-07-02 15:30,0,1.14608E+18,1.14608E+18,,0,0,0,RT CREWcrew G countries where Ivanka Trump has registered trademarks Australia Brazil Canada China France Germany India Indones,,Jerry Stirewalt,Minnesota USA,7.77999E+17
2019-07-02 15:30,0,1.14608E+18,1.14608E+18,,0,0,0,Happy belated Canada day my coworker is indigenous and this white lady spent  whole minutes grilling her about how she got her tan,,Tegan,,1.06932E+18
2019-07-02 15:30,0,1.14608E+18,1.14608E+18,,0,0,0,RT KirolosSam The price for insulin costs  in Canada the same amount costs  in AMERICA Do you know why Because OUR DEMOCRATS PAR,,MCozz,,1.07842E+18
2019-07-02 15:30,0,1.14608E+18,1.14608E+18,,0,0,0,RT boosterpang  HAPPY CANADA DAY Go play some street hockey and crack open a beer with your boy Jamie Have a great hol,,GalaxyInk,,1.13455E+18
2019-07-02 15:30,0,1.14608E+18,1.14608E+18,,0,0,0,RT SkateCanada Skate Canada Announces  National TeamCreatingHistoryPatinage Canada annonce lquipe n,, idf,ireland uk  ,1696850287
2019-07-02 15:30,0,1.14608E+18,1.14608E+18,,0,0,0,RT thesleepsherpa Missed out on MemorialDay mattress sales Heres your chance to win a Made in Canada memoryfoammattress by Polysleep,,HarmonyPerez,,1.03455E+18
2019-07-02 15:30,0,1.14608E+18,1.14608E+18,,0,0,0,Convocatoria Gobierno de Canad financiamiento diferentes proyectos sociales e igualdad de gnero ,,Trabajo Humanitario,,4324344143
2019-07-02 15:30,0,1.14608E+18,1.14608E+18,,0,0,0,RT mak F Canada day This settler colonial state was founded on and continues to practice genocide against Indigenous peoples  A,,Will Mawer,Alberta Canada,38758987
2019-07-02 15:30,0,1.14608E+18,1.14608E+18,,0,0,0,RT spectatorindex G countries by govt debt as share of GDPJapan Italy US France Brazil UK Canada ,,Henry J S,,2887164894
2019-07-02 15:30,0,1.14608E+18,1.14608E+18,,0,0,0,RT velasquezluis GTAveledo JulioBorges Igual atacan al embajador en Canada porque tiene xito La onda es destruir a Guaido que es apo,,NoticiasSimonBolivar,Espaa,892082466
2019-07-02 15:30,0,1.14608E+18,1.14608E+18,,0,0,0,RT ABFortisEtLiber tleehumphrey MarcBarabe charlesadler OMG Theyre waving to the crowd  realDonaldTrump derangement at its highest,,JForest,,3150800516
2019-07-02 15:30,0,1.14608E+18,1.14608E+18,156314187,0,0,0,NoLore SPVM Post Happy Canada Day,,Bill Poppe ,Calgary AB,1858386793
2019-07-02 15:30,0,1.14608E+18,1.14608E+18,,0,0,0,RT emgfind Citizen tax   ,,emgfind,Alberta Canada,2925571294
2019-07-02 15:30,0,1.14608E+18,1.14608E+18,,0,0,0,The  finalists for TelusPitch Canadas largest small business contest include several of our clients and col ,,Business Link,Alberta Canada,539420824
2019-07-02 15:30,0,1.14608E+18,1.14608E+18,,0,0,0,RT anthonyfurey Lets be clear folks Canadas biggest problems right now relate to China But Trudeau did not have an actual meeting wit,,CI Junkie,,1.10135E+18
2019-07-02 15:30,0,1.14608E+18,1.14608E+18,,0,0,0,RT contrariansmind Theres no opposition now how a quiet Canada town became a world leader in growing weed ,,Mark Alvarez,New York USA,1.0217E+18
2019-07-02 15:30,0,1.14608E+18,1.14608E+18,,0,0,0,I love this song ,,Adobea,Accra Ghana,7.09835E+17
2019-07-02 15:30,0,1.14608E+18,1.14608E+18,,0,0,0,RT DavidLe Visit Avg Antivirus to avail Avg Contact Help Number avgcontactnumber  for  USACANADA  and get in tou,,David Lewis,atla,1.12655E+18
2019-07-02 15:30,0,1.14608E+18,1.14608E+18,,0,0,0,RT Reuters A group called Caravan to Canada traveled from Minneapolis Minnesota and stopped at London Ontario seeking affordable pric,,MAB,,1.14474E+18
2019-07-02 15:30,0,1.14608E+18,1.14608E+18,,0,0,0,RT Norlaine It is incredible and shocking that major Canadian news outlets ran a clip from a source like Canada Proud It is even more ap,,Hope Aldridge,,292468351
2019-07-02 15:30,0,1.14608E+18,1.14608E+18,1.13E+18,0,0,0,rusthxc happy belated Canada day ,,Elliott Cohen,Connecticut USA,1340724564
2019-07-02 15:30,0,1.14608E+18,1.14608E+18,80994472,0,0,0,ageerkens It so full of shit You wanted nothing to do with me I came across Canada to see my family and you an ,,Kathlynn Sweet,,1.0854E+18
2019-07-02 15:30,0,1.14608E+18,1.14608E+18,,0,0,0,To celebrate Canada Day our MeritMonday is all about Canadian Construction Facts Take a look ,,Merit Saskatchewan,Saskatchewan,809178734
2019-07-02 15:30,0,1.14608E+18,1.14608E+18,,0,0,0,RT ShawnMendes Happy Canada day I love Canada   ,,CITY LIGHTS,iKON is coming to town,2153494695
2019-07-02 15:30,0,1.14608E+18,1.14608E+18,,0,0,0,UberEats  Off Your First Two Orders Promo Code eatsuberfree Free Food Toronto Canada Coupon,,Canada Deals Co,Canada,7.42445E+17
2019-07-02 15:30,0,1.14608E+18,1.14608E+18,,0,0,0,Want to work in Hamilton ON Canada View our latest opening  Driver BusDriver,,TMJCAW Transp Jobs,Kitchener Canada,49841221
2019-07-02 15:30,0,1.14608E+18,1.14608E+18,,0,0,0,RT actionalberta ,,Richard Lambert,Canada,7.08908E+17
